,id,conversation_id,created_at,date,timezone,place,tweet,language,hashtags,cashtags,user_id,user_id_str,username,name,day,hour,link,urls,photos,video,thumbnail,retweet,nlikes,nreplies,nretweets,quote_url,search,near,geo,source,user_rt_id,user_rt,retweet_id,reply_to,retweet_date,translate,trans_src,trans_dest
0,1349347971633197059,1349347971633197059,1610544600000.0,2021-01-13 20:30:00,+0700,,The #MaximumPressure campaign didn’t just constrain the world’s leading terror regime. It gave Israel and its neighbors the confidence to forge ahead with a warm peace. #AbrahamAccords  https://t.co/53bw7Q4X56,en,"['maximumpressure', 'abrahamaccords']",[],988573326376427520,988573326376427520,SecPompeo,Secretary Pompeo,3,20,https://twitter.com/SecPompeo/status/1349347971633197059,[],['https://pbs.twimg.com/media/ErnWWAnXYA0hJlE.jpg'],1,https://pbs.twimg.com/media/ErnWWAnXYA0hJlE.jpg,False,24064,686,4653,,#AbrahamAccords,,,,,,,[],,,,
1,1349370620132265984,1349370620132265984,1610550000000.0,2021-01-13 22:00:00,+0700,,"We flipped the script. For decades, foreign policy “experts” claimed we had to forge peace between Israel and the Palestinians before we could get peace deals in the region. We proved them all wrong. #AbrahamAccords  https://t.co/rwJzta8LG7",en,['abrahamaccords'],[],988573326376427520,988573326376427520,SecPompeo,Secretary Pompeo,3,22,https://twitter.com/SecPompeo/status/1349370620132265984,[],['https://pbs.twimg.com/media/Ernnx2DXMAAhVFw.jpg'],1,https://pbs.twimg.com/media/Ernnx2DXMAAhVFw.jpg,False,23778,687,5056,,#AbrahamAccords,,,,,,,[],,,,
2,1349363070238248963,1349363070238248963,1610548200000.0,2021-01-13 21:30:00,+0700,,Lots of good diplomats delivered a more peaceful and prosperous Middle East. #AbrahamAccords  https://t.co/jGMycRdgfP,en,['abrahamaccords'],[],988573326376427520,988573326376427520,SecPompeo,Secretary Pompeo,3,21,https://twitter.com/SecPompeo/status/1349363070238248963,[],"['https://pbs.twimg.com/media/ErnfDpJXAAMRpvC.jpg', 'https://pbs.twimg.com/media/ErnfFTFXYAIECj1.jpg', 'https://pbs.twimg.com/media/ErnfGXjW8AMBzQP.jpg', 'https://pbs.twimg.com/media/ErnfHryXMAABqgn.jpg']",1,https://pbs.twimg.com/media/ErnfDpJXAAMRpvC.jpg,False,18537,437,3250,,#AbrahamAccords,,,,,,,[],,,,
3,1349373245338701834,1349373245338701834,1610550626000.0,2021-01-13 22:10:26,+0700,,"Following the signing of the #AbrahamAccords, @shamma joined the UAE Jewish community for a Shabbat dinner and spoke on the opportunity for 🇦🇪 🇮🇱 cooperation and religious tolerance between both countries.  Read the @TimesofIsrael piece here:  https://t.co/JWdyRqKw2N",en,['abrahamaccords'],[],109087375,109087375,UAEEmbassyUS,UAE Embassy US,3,22,https://twitter.com/UAEEmbassyUS/status/1349373245338701834,['http://bit.ly/2Gp1Vgg'],[],0,,False,116,4,35,,#AbrahamAccords,,,,,,,[],,,,
4,1349302581638688769,1349302581638688769,1610533778000.0,2021-01-13 17:29:38,+0700,,More great news from the #AbrahamAccords  https://t.co/0m772Or5fz,en,['abrahamaccords'],[],1294027221166895104,1294027221166895104,UAEIsraelBiz,UAE-Israel Business Council,3,17,https://twitter.com/UAEIsraelBiz/status/1349302581638688769,['https://www.jpost.com/middle-east/first-of-its-kind-bar-ilan-and-uae-university-sign-academic-collaboration-655234'],[],0,,False,61,3,16,,#AbrahamAccords,,,,,,,[],,,,
5,1349379564921827328,1349379564921827328,1610552133000.0,2021-01-13 22:35:33,+0700,,UAE 🇦🇪 citizens travel to Israel 🇮🇱 visa-free. God-willing KSA 🇸🇦 will follow suit this year. #AbrahamAccords  https://t.co/YypcS3RrEz,en,['abrahamaccords'],[],18809354,18809354,AviKaner,Avi Kaner ابراهيم אבי,3,22,https://twitter.com/AviKaner/status/1349379564921827328,[],['https://pbs.twimg.com/media/Ern1j8oXUAEFsUO.jpg'],1,https://pbs.twimg.com/media/Ern1j8oXUAEFsUO.jpg,False,47,6,4,,#AbrahamAccords,,,,,,,[],,,,
